id,name,host_id,host_name,neighbourhood_group,neighbourhood,latitude,longitude,room_type,price,minimum_nights,number_of_reviews,last_review,reviews_per_month,calculated_host_listings_count,availability_365,number_of_reviews_ltm,license
27043484,City Of Bristol Loft Space,53437015,Simon,,Knowle,51.43811,-2.57402,Private room,43,2,56,2022-12-04,1.29,1,59,19,
27071310,Cosy double room in St Andrews with lovely garden,116218968,Daniel,,Ashley,51.46985,-2.59066,Private room,49,1,30,2022-11-16,0.56,2,165,14,
27123784,"6 bed flat (18 people), city, Stag/Hen welcome",54503007,Patrick,,Central,51.45354,-2.59283,Entire home/apt,1250,2,72,2022-11-04,1.34,1,336,24,
27134532,Bright and beautiful  2 double bedroom flat,204278283,Frank,,Ashley,51.47396,-2.59087,Entire home/apt,119,2,132,2022-12-11,2.51,1,83,31,
27213583,Small single bedroom in the heart of Lawrence Hill,79009580,Kate,,Lawrence Hill,51.45765,-2.56637,Private room,25,2,19,2020-02-07,0.36,3,27,0,
27247059,Modern & cheerful 3 bed family home with parking,25275287,Ben,,Stoke Bishop,51.48732,-2.63558,Entire home/apt,200,2,1,2022-08-06,0.21,1,0,1,
27273573,Cosy 1 bed flat with beautiful garden,205219745,Kate,,Easton,51.46058,-2.55968,Entire home/apt,328,2,13,2019-09-05,0.24,1,272,0,
27295852,Peaceful room in quiet leafy location,37813819,Rhian,,Frome Vale,51.48282,-2.52302,Private room,25,1,59,2022-12-17,1.24,1,34,22,
27397464,City Centre Apartment - The brassworks,173164894,Sarah,,Lawrence Hill,51.45677,-2.579,Entire home/apt,88,2,201,2022-12-11,3.77,1,316,43,
27477406,2-Bed Family Home with Sunny Garden,65192629,Hopewell,,Easton,51.46238,-2.56326,Entire home/apt,88,1,118,2022-11-27,2.21,141,360,19,
27523407,"Large quirky room,double cabin bed,sun room lounge",31999039,Anita,,Easton,51.46823,-2.56591,Private room,45,7,3,2019-10-10,0.08,4,32,0,
27564448,"Silbury Rd, Ashton Vale",61530225,Giovanni,,Bedminster,51.43497,-2.62854,Private room,45,2,71,2022-12-04,1.33,1,179,14,
27566475,Stylish Boho 1 Bedroom Apartment in Bristol,248344,Holly,,Bishopston & Ashley Down,51.47413,-2.58558,Entire home/apt,336,2,3,2018-09-06,0.06,1,244,0,
27576084,The Old Bank - No.1 - Your Apartment,125651447,Your Apartment,,Brislington West,51.44248,-2.5601,Hotel room,97,1,22,2022-12-09,0.43,67,328,5,
27576492,The Old Bank - No. 2 - Your Apartment,125651447,Your Apartment,,Brislington West,51.44089,-2.56094,Entire home/apt,96,1,34,2022-12-10,0.64,67,344,13,
27576748,The Old Bank - No.3 - Your Apartment,125651447,Your Apartment,,Brislington West,51.4408,-2.56026,Entire home/apt,96,1,31,2022-12-03,0.58,67,296,2,
27587231,The Old Bank - No.4 - Your Apartment,125651447,Your Apartment,,Brislington West,51.44451,-2.554,Entire home/apt,89,1,24,2022-12-04,0.45,67,346,9,
27593797,Bristol City Centre Apartment with Parking,120383529,Sameep,,Hotwells & Harbourside,51.45128,-2.60206,Entire home/apt,122,1,119,2022-12-14,2.25,1,303,20,
27622534,"Woodburner, City View or Blanket box room",360195,Sarah,,Windmill Hill,51.43999,-2.59115,Private room,41,1,36,2022-12-07,0.76,5,2,10,
27675544,Room with parking Bristol City Bristol Airport,208886185,Wesley,,Hengrove & Whitchurch Park,51.4072705,-2.5919653,Private room,55,1,0,,,3,365,0,
27696670,Attractive one bed flat in Clifton Village,209074663,Rozzy,,Clifton,51.45387,-2.61963,Entire home/apt,100,2,53,2022-12-11,1.01,1,202,13,
27830397,A tranquil hideaway in Clifton Village,15363066,Shena,,Clifton,51.45252,-2.62102,Private room,65,2,205,2022-12-11,4.00,1,41,59,
27830423,Bishopston Room,75845019,Susan,,Redland,51.47906,-2.59584,Private room,50,1,45,2022-06-11,0.85,1,0,3,
27849133,"The Garden Flat - parking, Whiteladies & UoB",210321255,Anna,,Clifton Down,51.46237,-2.61065,Entire home/apt,63,3,261,2022-12-06,4.95,1,186,35,
27997624,"Gorgeous 3 Bedroom Town House In Clifton, Bristol",211085471,Natalie,,Clifton,51.45415,-2.62373,Entire home/apt,168,2,96,2022-12-07,1.88,1,118,51,
28007880,Lovely private room in a family home,211534713,Suzanna,,Lockleaze,51.48655,-2.56768,Private room,28,1,259,2022-12-02,4.93,1,163,59,
28039798,Newly renovated family home in heart of Bristol,3418651,Tom,,Redland,51.47651,-2.59613,Entire home/apt,264,4,12,2019-12-27,0.23,1,140,0,
28140070,Ashley down studio flat,62109272,Mohamed,,Bishopston & Ashley Down,51.47852,-2.57969,Entire home/apt,40,1,11,2020-03-06,0.26,1,330,0,
28171946,City Of Bristol Apartment with Large Garden,60127103,Patrick,,Cotham,51.46902,-2.59537,Entire home/apt,85,2,44,2021-11-28,0.84,1,0,0,
28234444,No 75,213266388,Richard,,Horfield,51.49177,-2.57981,Private room,31,1,147,2022-09-16,2.85,1,126,40,
28243731,Stylish city penthouse room with balcony & parking,48681911,Katie,,Redland,51.47453,-2.59232,Private room,71,1,102,2022-12-18,1.96,1,71,30,
28253368,Self-contained studio with off street parking,93489115,Kate,,Eastville,51.47915,-2.53965,Entire home/apt,60,1,129,2022-12-18,2.50,1,126,28,
28269452,Stunning peaceful apartment nr Bristol TempleMeads,16961112,Adam,,Brislington West,51.43629,-2.56117,Entire home/apt,130,2,73,2022-09-11,1.40,1,271,16,
28293669,2 bedroom apartment in Bristol City Centre,7892156,Rose,,Central,51.460114,-2.593274,Entire home/apt,173,2,13,2022-10-17,2.10,1,10,13,
28339361,Sunny and modern flat in a Georgian House,100517387,Hisham Felip,,Eastville,51.48341,-2.55878,Entire home/apt,60,4,12,2021-12-05,0.23,2,0,0,
28384744,"Cosy ,rustic,self contained guest suite",214294715,Tony,,St George West,51.45999,-2.55282,Entire home/apt,49,2,261,2022-12-11,5.00,1,20,74,
28490291,Double bedroom in a sunny modern flat,100517387,Hisham Felip,,Eastville,51.48357,-2.55675,Private room,37,1,70,2022-11-12,1.35,2,56,1,
28635166,Characterful Family Home- close to city centre,12917949,Ollie & Katherine,,Southville,51.44321,-2.60285,Entire home/apt,174,4,11,2021-09-20,0.22,1,6,0,
28654560,[Rare!] BS3 Cozy Room Garden View Perfect Location,32808632,Chloé,,Bedminster,51.43636,-2.60424,Private room,39,1,28,2022-07-30,0.56,3,56,1,
28678621,Bright Modern Apartment in Bristol,19948901,Simon,,Knowle,51.44269,-2.56708,Entire home/apt,80,3,45,2022-07-27,0.89,1,230,11,
28731987,"Henleaze, en-suite king size double, free parking",16091010,Catherine,,Westbury-on-Trym & Henleaze,51.48994,-2.60082,Private room,41,2,73,2022-12-19,1.45,1,58,21,
28807707,"Breathtaking room, Bath in the room huge space",1156132,Maria,,Ashley,51.47035,-2.58472,Private room,107,2,2,2022-04-27,0.22,2,24,2,
28905732,Sunny central family home with great views,30760760,Susy,,Ashley,51.46998,-2.5869,Entire home/apt,170,3,13,2022-08-21,0.31,1,183,3,
29087234,Lovely room in private house,43873674,Jackie,,Bishopston & Ashley Down,51.47634,-2.58945,Private room,41,2,52,2022-12-12,1.03,2,90,26,
29185738,Woodcroft Sanctuary with Sauna and Forest Views,973549,Joy,,Brislington East,51.44404,-2.54161,Private room,75,1,16,2022-05-08,0.32,2,81,4,
29416965,"Victorian house, bedroom and separate  bathroom",20605126,Val,,Clifton Down,51.46994,-2.61011,Private room,65,1,12,2022-07-26,0.29,2,79,5,
29530787,Beautiful Blue Room in Artistic household,87714363,Hilary,,Cotham,51.46385,-2.59162,Private room,50,2,5,2020-02-10,0.10,2,71,0,
29542546,Garden Double Bed & Ensuite in Trendy St.Werburghs,79599223,Ralph,,Ashley,51.46775,-2.57278,Private room,25,4,64,2022-05-10,1.26,2,0,1,
29621715,Modern Holiday Home with Hot Tub,171178909,Ashley,,Avonmouth & Lawrence Weston,51.50331,-2.65346,Entire home/apt,130,2,208,2022-12-07,4.10,1,338,71,
29767400,"Bright, book-filled flat in artsy Stokes Croft",53674345,Lyndsey,,Ashley,51.46502,-2.58728,Entire home/apt,119,2,49,2022-12-07,0.98,1,0,26,
29878335,Double Room in Southville,27540782,Sophia,,Southville,51.44453,-2.60589,Private room,38,3,5,2021-07-11,0.11,3,31,0,
29905529,Quality King above a friendly funky pub.,32515363,Willow,,St George West,51.45838,-2.55154,Private room,103,1,41,2022-11-09,0.82,3,359,10,
29906542,Quality King above a funky friendly Bristol pub,32515363,Willow,,St George West,51.46009,-2.5529,Hotel room,103,1,51,2022-11-19,1.03,3,357,17,
29926239,Cosy Room in a Friendly House,49188646,Damian & Irisa,,Filwood,51.4264,-2.59025,Private room,21,2,89,2021-12-18,1.78,1,0,0,
29980982,Cosy Victorian home 10 min bus Bristol city centre,35116208,Helen,,Lawrence Hill,51.463,-2.5682,Private room,34,2,176,2022-12-20,3.52,1,0,50,
30040039,Victorian townhouse in cosmopolitian Montpelier,219288156,Jaki & Tony,,Ashley,51.46795,-2.58291,Private room,42,2,222,2022-12-18,4.46,1,122,56,
30056098,Queens Apartments- Large Clifton Triangle Studio.,65192629,Hopewell,,Central,51.4566,-2.60417,Entire home/apt,72,1,33,2022-08-31,0.75,141,249,8,
30063807,Fishponds Lodge,32862540,Patrycja,,Eastville,51.47345,-2.55125,Entire home/apt,379,7,34,2022-09-04,0.75,10,330,12,
30082363,R1 LARGE ROOM WITH COMFY BEDS,32862540,Patrycja,,Eastville,51.47336,-2.55128,Private room,57,2,62,2022-12-09,1.25,10,34,6,
30083933,1 Bedroom App +parking,65192629,Hopewell,,Ashley,51.46102,-2.59067,Entire home/apt,76,1,26,2020-11-21,0.52,141,0,0,
30109319,Private room available in character BS9 home,6164180,Simon,,Stoke Bishop,51.47337,-2.63594,Private room,55,2,51,2022-12-04,1.02,1,147,17,
30124216,R2 LARGE ROOM WITH PRIVATE BATHROOM,32862540,Patrycja,,Eastville,51.47326,-2.55039,Private room,70,2,55,2022-01-02,1.10,10,34,1,
30124359,R3 QUIET LARGE ROOM,32862540,Patrycja,,Eastville,51.47356,-2.54999,Private room,58,2,54,2022-10-21,1.08,10,34,3,
30124441,R5 BEAUTIFUL ROOM ON ATTIC,32862540,Patrycja,,Eastville,51.47405,-2.55047,Private room,58,2,58,2022-11-04,1.17,10,32,8,
30142663,The Alma Taverns Boutique Suites - Room 1 - Hopewell,65192629,Hopewell,,Clifton Down,51.46255,-2.61483,Hotel room,74,1,94,2022-10-26,1.96,141,66,10,
30144539,The Alma Taverns Boutique Suites Room 2 - Hopewell,65192629,Hopewell,,Clifton Down,51.46255,-2.61483,Hotel room,61,1,142,2022-12-12,2.95,141,83,56,
30192770,The Alma Taverns Boutique Suites - Room 3 - Hopewell,65192629,Hopewell,,Clifton,51.46251,-2.617,Hotel room,61,1,63,2022-06-02,1.31,141,70,6,
30192991,The Alma Taverns Boutique Suites - Room 4 - Hopewell,65192629,Hopewell,,Clifton Down,51.46255,-2.61483,Private room,74,1,52,2022-05-28,1.08,141,82,5,
30193144,The Alma Taverns Boutique Suites - Room 5 - Hopewell,65192629,Hopewell,,Clifton Down,51.46255,-2.61483,Hotel room,74,1,66,2022-12-19,1.39,141,68,15,
30261678,Double Bed Musicians Den in Trendy St. Werburghs,79599223,Ralph,,Ashley,51.46775,-2.57278,Private room,28,4,22,2022-08-14,0.44,2,0,5,
30308613,Stylish flat next to Temple Meads train station,227623232,Ana,,Lawrence Hill,51.45318,-2.58,Entire home/apt,75,3,54,2022-05-02,1.15,2,0,6,
30398903,Cuthbert House - Two Double Bedrooms,73802134,Alys,,Brislington West,51.43938,-2.55303,Entire home/apt,86,3,50,2022-12-21,1.11,1,318,18,
30420115,Cosy Tree House with private balcony + lake view,23560849,Ruby,,Eastville,51.47879,-2.5555,Entire home/apt,85,2,88,2021-11-14,1.79,2,0,0,
30423033,"Cool, arty, family home in Bristol",12159297,Dom,,Cotham,51.46779,-2.60699,Entire home/apt,271,2,91,2022-12-11,1.88,1,80,30,
30464483,Charming Victorian 3 bed Terrace,3209298,Jo,,Southville,51.44303,-2.61225,Entire home/apt,150,3,9,2022-12-11,0.26,1,2,4,
30557879,Bristol Family Home,35626375,Lisa,,Eastville,51.47368,-2.54475,Entire home/apt,70,6,6,2022-08-30,0.12,1,0,3,
30702039,Self-Contained Annexe Flat with Parking & Garden,11788371,Florina,,Southmead,51.50589,-2.59562,Entire home/apt,45,1,122,2022-11-18,2.52,1,86,28,
30760761,Warm and comfortable home in Westbury Park.,13748323,Janet,,Westbury-on-Trym & Henleaze,51.47982,-2.61525,Entire home/apt,137,3,82,2022-11-14,1.71,1,82,18,
30760891,Superb Peaceful 1 bed apartment Free Parking,178961162,Ella,,St George West,51.46242,-2.5433,Entire home/apt,65,1,136,2021-10-23,2.77,2,18,0,
30880692,"Off Whiteladies Rd nr Uni, BBC, Hospitals, Clifton",70042478,Alex,,Clifton Down,51.462448,-2.60826,Entire home/apt,54,4,194,2022-10-23,3.99,1,1,58,
30921805,Christmas Steps Quirky 2 Bed - Hopewell,46710015,Davinia,,Central,51.45661,-2.59796,Entire home/apt,118,3,86,2022-12-21,2.05,1,243,26,
31058068,STUNNING City Centre Living - with parking,203069597,Max,,Central,51.45641,-2.59799,Entire home/apt,179,2,148,2022-12-22,4.32,1,53,65,
31290151,Luxurious flat with own entrance and parking,9172761,(Email hidden by Airbnb),,Clifton,51.45582,-2.61101,Entire home/apt,80,2,332,2022-12-27,6.89,2,124,89,
31304967,1 bed apartment in the city centre,234306227,Carly,,Ashley,51.46611,-2.58698,Entire home/apt,100,1,20,2019-12-01,0.45,1,0,0,
31337100,Artist Designed Victorian Town House Totterdown,2337906,Juliette,,Windmill Hill,51.43963,-2.58305,Entire home/apt,136,2,62,2022-10-02,1.29,2,0,8,
31366949,"Newly renovated , Tiny House , 1 Bed Studio",124962701,Guy,,Clifton,51.45204,-2.61723,Entire home/apt,75,2,69,2022-12-22,4.17,1,2,44,
31410851,Spacious and characterful 3 bedroom family home,121050747,Johnathan,,Horfield,51.49305,-2.58111,Entire home/apt,125,2,9,2022-11-20,2.20,1,320,9,
31433074,"Light, peaceful double in characterful house",33415791,Claire,,Easton,51.46606,-2.56499,Private room,35,14,8,2020-12-07,0.17,1,271,0,
31505243,Marsh House Stay,77234180,Fran,,Central,51.45283,-2.59599,Entire home/apt,97,2,73,2022-11-18,1.76,1,304,25,
31554076,Lovely 1-bed flat in a quiet green area,14087241,Kristina,,Henbury & Brentry,51.50689,-2.62071,Entire home/apt,90,1,2,2022-05-29,0.28,1,0,2,
31639658,Cosy flat - 1 bedroom flat in the heart of Bristol,236711593,Tom And Sarah,,Lawrence Hill,51.45791,-2.58033,Entire home/apt,438,2,3,2019-06-18,0.06,1,300,0,
31642656,"Beautiful room, 10 mins walk to Gloucester Road.",66549798,Hannah,,Bishopston & Ashley Down,51.4771,-2.58105,Private room,76,2,16,2022-11-27,2.22,1,365,16,
31727078,"Lovely 2-bed apartment, popular Gloucester Road",69034352,Lisa,,Bishopston & Ashley Down,51.48571,-2.58606,Entire home/apt,115,2,42,2020-09-30,0.88,1,210,0,
31740188,Modern luxury apartment in Bristol City Centre,236481623,Mairead,,Central,51.46164,-2.59085,Entire home/apt,106,2,186,2022-12-01,3.91,34,269,50,
31791712,Bright 1 double bed apartment near Cabot Circus,238258865,Sam,,Ashley,51.4598,-2.58409,Entire home/apt,88,1,105,2022-12-04,2.24,1,0,27,
31795832,The Alma Taverns' Exclusive Accommodation - Hopewell,65192629,Hopewell,,Clifton Down,51.46252,-2.61473,Entire home/apt,461,1,22,2022-12-04,0.49,141,52,9,
31796234,3 bedroom Shirehampton flat near Avonmouth & M4,51686051,Michael,,Avonmouth & Lawrence Weston,51.49026,-2.67797,Entire home/apt,134,2,27,2022-12-02,0.57,17,89,5,
31946180,Fantastic 2 double bedroom apartment,34763945,Mary,,Hartcliffe & Withywood,51.41558,-2.61722,Entire home/apt,145,3,22,2022-06-11,0.52,3,88,4,
31952623,Charming Victorian Apartment- Vibrant Central Area,68684564,Ollie,,Redland,51.47203,-2.59628,Entire home/apt,76,4,162,2022-12-07,3.44,1,123,47,
31976664,Large Clifton One Bed Flat + Parking,65192629,Hopewell,,Clifton,51.45647,-2.61503,Entire home/apt,84,1,114,2022-12-10,2.41,141,324,32,
31986243,"Central, beautiful spacious home, kid-friendly",54458332,Eliza,,Ashley,51.46902,-2.58398,Entire home/apt,278,3,3,2022-08-29,0.66,2,76,3,
32016640,Comfortable Double in the Shire,141817337,Olivia,,Avonmouth & Lawrence Weston,51.49428,-2.68449,Private room,28,1,4,2019-09-27,0.09,1,33,0,
32032024,Lovely double in friendly home with breakfast!,30298096,Caron,,Westbury-on-Trym & Henleaze,51.49067,-2.59607,Private room,49,2,35,2022-11-18,0.75,1,78,9,
32175468,"Charming & Spacious Garden Flat, Clifton Triangle",241410743,Jamie,,Clifton,51.4574,-2.60951,Entire home/apt,110,1,99,2022-12-21,2.10,1,311,26,
32288245,Toad Lodge The Brown Room,100890506,Lydia,,Cotham,51.46346,-2.5994,Private room,46,1,118,2022-12-11,2.52,3,341,73,
32288430,Toad Lodge The Green Room,100890506,Lydia,,Cotham,51.46406,-2.59851,Private room,47,1,258,2022-11-19,5.51,3,350,80,
32310759,Attic room with en suite,242554151,Mark,,Windmill Hill,51.43942,-2.58056,Private room,40,3,105,2022-12-18,2.24,1,60,25,
32330644,Cosy Bristol flat,95156661,Graham,,Lockleaze,51.48738479614258,-2.5671350955963135,Private room,32,4,23,2022-09-13,0.49,2,8,4,
32334406,"LOVELY 2 BEDROOM FLAT, ENTIRE PLACE, EASTVILLE",159464911,Ihsan,,Lockleaze,51.47498,-2.56692,Private room,75,1,8,2019-07-20,0.17,1,0,0,
32349932,"Warm, spacious single in quiet period house",197909305,Andy,,Cotham,51.46977,-2.60628,Private room,48,2,42,2022-11-27,0.89,3,11,3,
32351591,"Warm, spacious double in quiet period house",197909305,Andy,,Cotham,51.46982,-2.60483,Private room,56,2,53,2022-12-04,1.13,3,11,5,
32351662,"Sleeps 6, 2 bed. Close to Temple Meads railway",125651447,Your Apartment,,Brislington West,51.44349,-2.55485,Entire home/apt,145,1,11,2022-05-06,0.28,67,357,2,
32471652,Room v near Southmead hospital,83768162,Ernst,,Horfield,51.48902,-2.58901,Private room,30,1,30,2022-12-07,0.64,4,9,25,
32484335,Large light room in Easton for WOMEN ONLY,216097975,Laura,,Easton,51.46595,-2.56258,Private room,29,1,127,2022-12-22,2.73,2,8,50,
32512839,"Apartment in Quiet, City Centre, Historic Building",244295459,Elizabeth,,Lawrence Hill,51.45562,-2.58297,Entire home/apt,106,3,78,2022-12-06,1.78,1,162,36,
32523240,Family home stay that also supports the homeless,6410293,Polly,,Easton,51.46355,-2.55686,Entire home/apt,100,1,42,2022-08-28,0.90,1,0,13,
32548284,Georgian Home for Comfort and Rest,244585989,David,,Cotham,51.47125,-2.60961,Private room,28,1,91,2020-03-15,1.95,1,87,0,
32608994,Bright & airy double room nr popular North Street,11144283,Lucy,,Bedminster,51.4364,-2.60852,Private room,35,2,9,2019-07-14,0.20,2,296,0,
32624841,"Experience Bristol & Bath; Sunny, Hip, Central apt",8185082,Roxy,,Lawrence Hill,51.45595,-2.57914,Entire home/apt,123,2,114,2022-11-25,2.45,2,301,38,
32728599,Duplex! Penthouse! Private Rooftop!  Location!,152788806,Pass The Property,,Lawrence Hill,51.45747,-2.58088,Entire home/apt,188,3,55,2022-08-18,1.19,21,93,16,
32835191,Modern Studio w/Kitchen in Quiet Suburb,52701992,Rosie,,Avonmouth & Lawrence Weston,51.48485,-2.67568,Entire home/apt,71,14,21,2022-12-10,0.70,1,251,10,
32886255,⭐️Beautiful 2 Bedroom House In St Werburgs⭐️,247001143,Pauline,,Bishopston & Ashley Down,51.47551,-2.57666,Entire home/apt,294,2,0,,,1,267,0,
33085525,"Studio 28, a stylish, sunny, studio apartment",12535455,Gabrielle,,Bishopston & Ashley Down,51.48361,-2.58312,Entire home/apt,47,2,205,2022-12-11,4.49,1,129,67,
33111243,Deluxe Double Room above a funky pub,32515363,Willow,,St George West,51.45913,-2.55341,Private room,103,1,2,2021-08-13,0.07,3,363,0,
33126419,Spacious Clifton flat with private courtyard,249378606,Benjamin,,Clifton Down,51.46674,-2.61623,Entire home/apt,137,5,48,2022-12-25,3.36,1,201,33,
33159173,Bright room in quiet homely flat on North St,29126981,Lauren,,Bedminster,51.44084,-2.60412,Private room,30,2,5,2019-09-20,0.12,2,2,0,
33211242,The Hubert,125651447,Your Apartment,,Ashley,51.461,-2.58426,Entire home/apt,206,1,48,2022-12-07,1.05,67,350,12,
33266492,Quiet private double room in Victorian terrace,22299882,Eliana,,Lawrence Hill,51.46772,-2.56827,Private room,39,1,7,2019-04-28,0.15,1,0,0,
33291040,City Hideaway with hot tub (family/couples only),104129631,Richard,,St George Troopers Hill,51.45472,-2.53249,Entire home/apt,162,2,261,2022-12-11,5.87,1,308,63,
33307058,Spacious Clifton Village garden apartment,10315523,Debbie,,Clifton,51.45505,-2.61528,Entire home/apt,128,3,18,2022-08-18,0.43,1,0,5,
33309577,"Family friendly house. 4 beds, 3 reception rooms.",109506458,Amy,,Eastville,51.47651,-2.53991,Entire home/apt,200,5,5,2019-10-20,0.11,2,207,0,
33314388,Lovely room to rent in Victorian house,64805680,Amanda,,Easton,51.46246,-2.55982,Private room,45,1,40,2022-12-11,0.91,1,81,19,
33361823,Modernised and spacious family home.,251312494,Jen,,Avonmouth & Lawrence Weston,51.49357,-2.67951,Entire home/apt,202,2,51,2022-11-27,1.23,1,363,21,
33378621,⭐  AMAZING House ⭐ Free Parking! 🚙⭐ Location! ⭐,251463576,Remi Martins,,Southville,51.441078,-2.612027,Entire home/apt,234,2,65,2022-12-05,1.44,2,355,6,
33384562,Brunel's Loft Apartments - No.1 - Your Apartment,125651447,Your Apartment,,Lawrence Hill,51.44733,-2.57494,Entire home/apt,93,1,9,2022-08-06,0.21,67,343,3,
33388257,Brunel's Loft Apartments - No.2 - Your Apartment,125651447,Your Apartment,,Lawrence Hill,51.44676,-2.57447,Entire home/apt,86,1,3,2022-04-22,0.13,67,347,1,
33389220,Victorian School House conversion in Upper Knowle,8410742,Zoe,,Knowle,51.4353,-2.56527,Private room,55,3,11,2022-10-16,0.29,1,89,7,
33422560,Exquisite & Elegant - Central and Peaceful.,251778415,Max,,Clifton,51.45053,-2.61442,Entire home/apt,88,2,150,2022-09-25,3.47,1,115,44,
33492080,"Cosy, creative garden flat in Easton",6470448,Jenny,,Easton,51.46251,-2.55717,Entire home/apt,65,2,36,2022-11-06,0.82,1,5,15,
33515556,"Bright, cosy studio apartment in Stokes Croft",17782869,Christabel,,Ashley,51.46054,-2.58652,Entire home/apt,105,2,91,2022-09-30,2.08,1,270,11,
33538344,"Light, Bright 2 Bedroom House ⭐️Private Garden⭐️",252721506,Aneta,,Lawrence Hill,51.46628,-2.57196,Entire home/apt,60,2,4,2022-05-29,0.09,1,0,1,
33605960,Lovely cosy ENTIRE home in Easton,216097975,Laura,,Easton,51.46791,-2.5624,Entire home/apt,84,2,8,2022-09-01,0.18,2,0,4,
33616612,"Stunning, spacious boutique apartment close to BBC",51686051,Michael,,Cotham,51.465786,-2.599881,Entire home/apt,93,30,3,2022-09-03,0.12,17,88,2,
33640858,Beautiful apartment in Clifton Wood area + parking,185237699,Andrey,,Clifton,51.4548,-2.61092,Entire home/apt,119,1,13,2022-02-20,0.29,1,0,3,
33700602,Self-contained garden annexe,254030818,Silvia,,Henbury & Brentry,51.50576,-2.62724,Entire home/apt,55,2,38,2020-12-27,0.85,1,149,0,
33704103,King Room,254057759,Natasha,,Hotwells & Harbourside,51.4548,-2.6061,Private room,130,1,6,2022-07-26,0.26,3,352,3,
33704926,Double Room,254057759,Natasha,,Hotwells & Harbourside,51.45598,-2.60603,Private room,124,1,14,2022-10-25,0.69,3,347,5,
33705130,Single Room,254057759,Natasha,,Central,51.45625,-2.60584,Private room,64,1,20,2021-12-19,0.74,3,352,0,
33707581,The Rodney Hotel - Double Room,254083013,The Rodney Hotel,,Clifton,51.45645,-2.61897,Private room,74,1,9,2022-02-06,0.25,3,359,2,
33707732,The Rodney Hotel - Small Double Room,254083013,The Rodney Hotel,,Clifton,51.45496,-2.61863,Private room,68,1,17,2022-08-31,0.47,3,357,5,
33707811,The Rodney Hotel - Single Room,254083013,The Rodney Hotel,,Clifton,51.4557,-2.61871,Private room,50,1,20,2022-10-24,0.71,3,359,12,
33763876,Family Room,254524614,The Washington,,Clifton Down,51.4586,-2.61123,Private room,79,1,27,2022-12-22,0.75,6,340,22,
33764113,King Room,254524614,The Washington,,Clifton Down,51.45945,-2.6101,Private room,78,1,2,2022-07-08,0.14,6,351,1,
33764190,Double Room,254524614,The Washington,,Clifton Down,51.45945,-2.61085,Private room,68,1,10,2022-12-22,0.90,6,359,10,
33764271,Twin Room,254524614,The Washington,,Clifton Down,51.45872,-2.60977,Private room,68,1,35,2022-12-06,1.97,6,360,30,
33764353,Single Room,254524614,The Washington,,Clifton Down,51.45928,-2.60941,Private room,48,1,17,2022-12-21,1.00,6,360,15,
33764428,Single Room with shared bathroom,254524614,The Washington,,Clifton Down,51.45994,-2.6094,Private room,43,1,38,2022-11-26,2.49,6,359,35,
33907148,"Kestrel room, Double Bed room, Frenchay Common",234694654,Barry,,Frome Vale,51.49241,-2.52116,Private room,55,1,11,2022-10-17,0.26,1,324,1,
34006701,Homely Victorian house near city centre,28491567,Daniel,,Ashley,51.46696,-2.57792,Entire home/apt,95,3,4,2021-07-25,0.10,1,0,0,
34047417,"En-suite, Kingsize, Attic room.",109506458,Amy,,Eastville,51.4778,-2.54134,Private room,50,2,37,2022-10-31,0.83,2,266,1,
34057880,higgihaus 7 Bed Large House Big Groups Best,164934575,Luke,,Clifton Down,51.4666,-2.60818,Entire home/apt,721,2,58,2022-12-04,1.35,7,110,25,
34168114,Cleyro Apartments - Finzels Reach 1 Bedroom Deluxe,60611927,Marianna,,Central,51.45518,-2.58924,Entire home/apt,159,1,9,2022-10-17,0.20,3,365,8,
34221336,Bright spacious loft room with en-suite in Bristol,40471345,Sally,,Bedminster,51.43983,-2.61131,Private room,73,2,76,2022-11-25,1.81,1,85,18,
34242088,Clifton Village Victoria Sq Large Apt 2 Bed/2 Bath,31202667,Sue,,Clifton,51.45598,-2.61645,Entire home/apt,102,2,207,2022-12-22,5.02,1,279,83,
34300862,"Calm, stylish double ensuite. Free WiFi & parking",12908465,Db,,Windmill Hill,51.43823,-2.58938,Private room,42,2,63,2021-11-07,1.46,1,143,0,
34375869,Newly refurbished flat near train station & centre,60695590,Zoe,,Windmill Hill,51.44147,-2.58049,Entire home/apt,101,3,18,2022-12-22,5.00,1,167,18,
34445544,Room with Private Bathroom in large Victorian Flat,59376561,James,,Redland,51.47297,-2.60823,Private room,47,2,62,2022-12-18,1.42,1,32,28,
34477631,"Friendly family home, double bed, close to centre",260249073,Nita,,Filwood,51.42933,-2.59346,Private room,34,1,177,2022-12-17,4.07,1,108,59,
34505914,"Comfortable room, quiet road with easy parking.",260432780,Caroline,,St George Troopers Hill,51.45765,-2.54099,Private room,28,1,85,2022-12-24,1.95,1,51,44,
34566626,Rowan Tree #8 - Your Apartment,125651447,Your Apartment,,Cotham,51.46321,-2.60058,Entire home/apt,173,1,6,2022-04-12,0.15,67,255,1,
34573443,Double Sleeper,13236513,Errol,,Easton,51.46504,-2.56181,Private room,43,1,54,2022-12-11,4.48,1,353,54,
34584604,Rowan Tree #7,125651447,Your Apartment,,Cotham,51.46161,-2.5998,Entire home/apt,250,1,4,2022-07-13,0.09,67,352,1,
34584845,Rowan Tree #6 - Your Apartment,125651447,Your Apartment,,Cotham,51.46144,-2.60024,Entire home/apt,268,1,11,2022-10-30,0.26,67,315,7,
34584887,Rowan Tree #5 - Your Apartment,125651447,Your Apartment,,Cotham,51.46135,-2.59981,Entire home/apt,316,1,5,2020-07-25,0.11,67,329,0,
34602703,Cotham Apartment Stokes Croft BS6 Bristol Views,2908382,GregandClare,,Cotham,51.46486,-2.5921,Entire home/apt,78,3,49,2022-12-11,1.17,3,303,25,
34697506,Sun drenched. well located- 2 room garden Annex,102749733,Carlos And Vittoria,,Bishopston & Ashley Down,51.48,-2.58541,Entire home/apt,116,2,78,2022-10-03,1.78,1,365,10,
